{"version":"source-lock/v1","recipe_id":"recipe:fixture","recipe_digest":"sha256:cc10cd6bd36d2471277934a07cac19b7b808c43e1e85e07bbfc31294f4135155","inputs":[{"input_id":"input:source","kind":"source","uri":"https://example.invalid/source/abcdef1","commit":"abcdef1","digest":"sha256:545f5ad97a1baec4139cd1bd34991788378eb1563e5e6a515481849fefbafea3","media_type":"application/octet-stream","relative_path":"src/source.bin"}],"closure_digest":"sha256:952eb05de1cf4a4348d193fcaeabd9c407f2737d62672beb4fd10244f713d933"}
